<?xml version="1.0" encoding="ISO-8859-1" standalone="yes"?>
<!DOCTYPE attributes SYSTEM "../ejercicio06.dtd">

<factura nfac="f999">
    <datos-empresa>
        <nombre>Equipos Digitales S.L.</nombre>
        <dir>Av. Valladolid</dir>
        <poblacion cod-postal="28043">Madrid</poblacion>
        <provincia>Madrid</provincia>
        <cif>Q-9876543</cif>
        <telefono/>
    </datos-empresa>

    <datos-cliente ncli="c879">
        <nombre>Dario Bueno Gutierrez</nombre>
        <dir-env>Av. Oporto, 7 - 4ºD</dir-env>
        <poblacion cod-postal="28043">Madrid</poblacion>
        <provincia>Madrid</provincia>
    </datos-cliente>

    <datos-factura nped="p731" iva="16" f-pago= "efectivo" moneda="euro">
        <fecha>12−01−2005</fecha>

        <linea>
            <ref>MII93000F/8</ref>
            <desc>MICRO PENTIUM IV 3000MHZ FB800</desc>
            <cant>1</cant>
            <precio>230</precio>
            <importe>266,80</importe>
        </linea>

        <linea>
            <ref>MB8QDIP4</ref>
            <desc>PLACA BASE QDI P4</desc>
            <cant>1</cant>
            <precio>180</precio>
            <importe>208,80</importe>
        </linea>

        <linea>
            <ref>MEDD512M32</ref>
            <desc>DIMM DDR 512MB 3200</desc>
            <cant>2</cant>
            <precio>40</precio>
            <importe>92,80</importe>
        </linea>

        <linea>
            <ref>HD250GSA7</ref>
            <desc>DISCO DURO 250GB S−ATA 7200</desc>
            <cant>4</cant>
            <precio>120</precio>
            <importe>556,80</importe>
        </linea>

        <base>970,00</base>
        <cuota-iva>155,20</cuota-iva>
        <total>1125,20</total>

    </datos-factura>
</factura>
